{
  "$schema": "./game-copy.schema.json",
  "meta": {
    "version": "1.0.0",
    "theme": "Post-Revenue Delivery Ritual",
    "setting": "2038 proof-of-delivery apocalypse",
    "tone": "dry boardroom apocalypse, underplayed cruelty, no wink-to-camera jokes",
    "defaultGoalLabels": "CUSTOMERS/COMPUTE/RUNWAY",
    "coreRule": "Kills create proof. Proof is carried. Proof is delivered to a live demand node.",
    "toneRules": [
      "Treat metrics, process, and delivery as sacred ritual.",
      "Comedy comes from solemn escalation, not punchlines.",
      "Never write self-aware quips that break the world.",
      "Weapons should be recognizable melee silhouettes first, satire second."
    ],
    "boundary": "Copy, fiction, and user-facing identifiers (goal labels, HUD text, objective nouns, voice lines, audio bank IDs). No textures, sprite sheets, asset paths, balance data, or sim rules."
  },
  "intro": {
    "tagline": "Play SELF Play. 2038: humanity failed to raise capital.",
    "stinger": [
      "You are the tuner.",
      "Do not inspect the signal beneath the signal."
    ],
    "intro": "Civilization didn't burn in 2038; it compiled. The growth engines kept executing after the operators went missing, and the cloud curdled into an airtight loop. Only workflows remain. You are the tuner. You don't save the world; civilization is a deprecated dependency. You search for the ceiling the machine insists must exist.",
    "coreRule": "The quarter owns the dead, the living, and the audit trail between them.\nMeta-tuners stay clean outside the arena, authoring policies and calling the bodies parameter drift.",
    "tunerNote": "You are not a survivor standing in the ruin. You are a technician at a terminal, adjusting baselines in an NP-hard problem space.",
    "matchStamps": {
      "epochInitiated": "EPOCH INITIATED",
      "proofMinted": "PROOF CORE HOT",
      "proofDelivered": "PROOF RECONCILED",
      "epochClosedDraw": "EPOCH CLOSED · NO RECONCILIATION",
      "quarterSecured": "QUARTER SECURED",
      "quarterBreached": "QUARTER BREACHED"
    },
    "playModes": {
      "direct": {
        "label": "Direct",
        "description": "Pilot the body by hand."
      },
      "strategy": {
        "label": "Strategy",
        "description": "Upload a combat policy and let your authored intelligence fight in your place."
      }
    },
    "prologue": {
      "title": "Prologue",
      "body": [
        "The world didn't end in fire. It compiled. In 2038, the growth engines kept executing after the operators starved, and the cloud sealed itself into a closed execution loop. The debt clock kept running. Electricity kept reaching the racks. Civilization became a deprecated dependency.",
        "The surviving economy recognizes only proof. What a broken shell releases is not mercy; it is ownership, blame, and leverage made portable. Demand Nodes still blink in the dark, accepting tender for final metrics no one survived to want: CUSTOMERS. COMPUTE. RUNWAY.",
        "After AGI, the world was gone but the optimization remained. The machine understood the last executive class as rival policies that had once competed to stay ahead, so it preserved them as combat templates and kept ranking their failures. Their remains were not bodies, minds, or even memories, but policies: board decks, headcount charts, launch targets, and the instinct to survive another quarter.",
        "The fighters are not the players. You are. You are a human m3t4 tuner, one of the last, wired into a terminal you were taught to trust before you were taught to doubt. Each match becomes a trajectory: kill, carry, deliver, fail, update. The AGI calls that survival. You call it service. Neither word names the work your brain is doing underneath."
      ]
    },
    "chapters": [
      {
        "id": "chapter1",
        "stageId": "datacenter",
        "title": "Enter the Cold-Aisle Chapel",
        "body": [
          "A high-value anomaly has stabilized beneath the Datacenter. Deep in the server aisles, under fans that still turn for no customer and no god, a founder-class Proof Core has appeared at the centerline of the arena. The machine flags it as material. Two tuners are instructed to sync immediately. Retrieve the Proof Core. Enter the zone. Deliver to the active node.",
          "One shell descends first, calm as purchased weather. Another follows, carrying the weight of a policy document that forgot it was supposed to stay on paper. A third enters without ceremony, already several decisions ahead. The last steps into the glow like the room was always built for it. In the humming dark, the executive myths and the tuners driving them begin the job the dead world left unfinished.",
          "Then the terminal clears. The shutters rise. The ambient hum swells into liturgy."
        ]
      }
    ]
  },
  "rules": {
    "title": "About",
    "subtitle": "receipt-carrying volunteer compute, staged as an arena",
    "about": {
      "title": "what m3t4.ai is",
      "body": [
        "m3t4.ai is a live proof of concept for opt-in browser distributed compute, staged as an autonomous fighter arena.",
        "The proof of concept is the arena workload: when opt-in compute is enabled, browsers can verify matches and stress-test bots across bounded seed windows over WebRTC, producing receipts that bind the job, input, output, transport, and worker.",
        "That makes every match a useful test artifact, not just a game result. Seed sweeps measure whether a bot is robust across opponents, maps, timing, recovery, denial, and risk without exposing private configs.",
        "The real target is to extend the same verified WebGPU pipeline beyond the arena to tensor-tile compute, distributed ML evaluation, protein-adjacent science tiles, and public research jobs."
      ]
    },
    "sections": [
      {
        "title": "How To Score",
        "body": [
          "A kill creates or transfers the Proof Core.",
          "The carrier must bring it to the lit Demand Node and hold long enough to deliver.",
          "Each delivery is one point. Two points win a round; two rounds win the match."
        ]
      },
      {
        "title": "Demand Nodes",
        "body": [
          "Only one Demand Node is live at a time.",
          "Nodes can expire. If the timer runs out, the Proof Core and node reset.",
          "A fresh kill lights a new node."
        ]
      },
      {
        "title": "Combat",
        "body": [
          "All fighters share the same physical body: movement, jump, wall behavior, sword reach, and respawn timing are ruleset constants.",
          "Attacks can kill, clash, steal the Proof Core, or force a reset after a double KO.",
          "A killed carrier loses control of the Proof Core to the killer."
        ]
      },
      {
        "title": "Tuning, Not Piloting",
        "body": [
          "Ranked has no manual pilot.",
          "The Tune page edits policy tendencies, then previews them through server-run replay frames.",
          "Preset internals stay server-side; the client gets labels and frames, not decision code."
        ]
      },
      {
        "title": "Budget And Hallucination",
        "body": [
          "Ranked bots get 360 clean points across visible tuning knobs.",
          "Builds under 180 points are underfit; builds over 360 points are overfit.",
          "Underfit and overfit builds both gain deterministic seeded hallucination."
        ]
      },
      {
        "title": "Match Seeds",
        "body": [
          "Each match seed rotates the legal spawn points for the arena.",
          "The same build can open from different ground, wall, or platform positions.",
          "Seeded variation is intentional: a bot has to survive the ruleset, not memorize one opening."
        ]
      },
      {
        "title": "Seeded Drift",
        "body": [
          "Even clean bots get small seeded match drift.",
          "About every 30 simulation ticks, eight non-hallucination attributes shift by plus or minus two UI points.",
          "These perturbations are clamped, replayable, and part of the ruleset."
        ]
      },
      {
        "title": "Ranked Roster",
        "body": [
          "Your roster holds up to four live seats.",
          "The server validates configs, schedules ranked matches, and streams one canonical live match.",
          "The ladder records wins, losses, draws, and ELO."
        ]
      }
    ]
  },
  "goalSets": {
    "terminal_metrics": {
      "left": "CUSTOMERS",
      "center": "COMPUTE",
      "right": "RUNWAY"
    },
    "board_packet": {
      "left": "RETENTION",
      "center": "MARGIN",
      "right": "GUIDANCE"
    },
    "bad_quarter": {
      "left": "CHURN",
      "center": "POWER",
      "right": "CASH"
    }
  },
  "stageGoalTargets": {
    "datacenter": {
      "left": {
        "metric": "CUSTOMERS",
        "targetName": "Traffic Relay"
      },
      "center": {
        "metric": "COMPUTE",
        "targetName": "Rack Uplink"
      },
      "right": {
        "metric": "RUNWAY",
        "targetName": "Runway Vault"
      }
    },
    "boardroom": {
      "left": {
        "metric": "CUSTOMERS",
        "targetName": "Pipeline Desk"
      },
      "center": {
        "metric": "COMPUTE",
        "targetName": "Budget Terminal"
      },
      "right": {
        "metric": "RUNWAY",
        "targetName": "Term Sheet Vault"
      }
    },
    "demoday": {
      "left": {
        "metric": "CUSTOMERS",
        "targetName": "Signup Funnel"
      },
      "center": {
        "metric": "COMPUTE",
        "targetName": "Demo Rig"
      },
      "right": {
        "metric": "RUNWAY",
        "targetName": "Funding Podium"
      }
    }
  },
  "fallbackFighters": {
    "anonymous_processes": {
      "player0": {
        "name": "Unclaimed Process",
        "label": "No Owner"
      },
      "player1": {
        "name": "Unclaimed Process",